id,title,description,position,status,lastmodifiedby,lastmodifieddatetime,domain,questionnaire_id
1000,Question Group One(1000),Question Group One includes two questions.,1,Active,echasin,2016-07-17 00:00:00,DEMO,1000
1101,Question Group One(1101),Question Group One includes two questions.,1,Active,echasin,2016-07-17 00:00:00,DEMO,1100
1102,Question Group Two(1102),Question Group Two includes two questions.,1,Active,echasin,2016-07-17 00:00:00,DEMO,1100
2001,Question Group One(2001),Question Group One includes two questions.,1,Active,echasin,2016-07-17 00:00:00,DEMO,2000
2002,Question Group Two(2002),Question Group Two includes two questions.,2,Active,echasin,2016-07-17 00:00:00,DEMO,2000
2003,Question Group Three(2003),Question Group Three includes two questions.,3,Active,echasin,2016-07-17 00:00:00,DEMO,2000
2004,Question Group Four(2004),Question Group Four includes two questions.,4,Active,echasin,2016-07-17 00:00:00,DEMO,2000
2005,Question Group Five(2005),Question Group Five includes two questions.,5,Active,echasin,2016-07-17 00:00:00,DEMO,2000
2006,Question Group Six(2006),Question Group Six includes two questions.,6,Active,echasin,2016-07-17 00:00:00,DEMO,2000
2007,Question Group Seven(2007),Question Group Seven includes two questions.,7,Active,echasin,2016-07-17 00:00:00,DEMO,2000
2008,Question Group Eight(2008),Question Group Eight includes two questions.,8,Active,echasin,2016-07-17 00:00:00,DEMO,2000
2009,Question Group Nine (2009),Question Group Nine includes two questions.,9,Active,echasin,2016-07-17 00:00:00,DEMO,2000
2010,Question Group Ten(2010),Question Group Ten includes two questions.,10,Active,echasin,2016-07-17 00:00:00,DEMO,2000
3001,Question Group One (3001),Question Group One includes 4 questions.,10,Active,echasin,2016-07-17 00:00:00,DEMO,3000